{
    "schema_version":  1,
    "artifact_type":  "review-report",
    "artifact_id":  "review-run",
    "run_id":  "2050-strict-r02",
    "task_id":  null,
    "attempt":  null,
    "profile":  "tooling",
    "harness":  "codex",
    "producer":  "workflow-code-review",
    "commit_sha":  "4eb6f91718dee2cb6ae905472f125363e1ad0955",
    "config_digest":  "sha256:2b03062f70ae7d3ea6b058bc6a424bd82ac1551c29ed14e7087d024daf9a8058",
    "created_at":  "2026-10-25T04:29:33.2393303Z",
    "payload":  {
                    "verdict":  "NEEDS_CHANGES",
                    "p0_count":  0,
                    "p1_count":  2,
                    "scope":  "run",
                    "review_profile":  "strict",
                    "round":  0,
                    "implementer_actor":  "/root",
                    "judge_actor":  "/root/strict_r02_judge",
                    "independence_basis":  "process-separated-agent"
                }
}