{
    "schema_version": 1,
    "artifact_type": "review-report",
    "artifact_id": "review-run",
    "run_id": "2051-runtime-replay-fix-r1",
    "profile": "tooling",
    "harness": "codex",
    "commit_sha": "4f322a74854379af2631ff14811118a6109955a9",
    "config_digest": "sha256:a0245b770035268ab4dc8fcdafd2895903ee08a0f5a4f22ab28ab851623a968e",
    "task_id": null,
    "attempt": null,
    "producer": "workflow-code-review",
    "created_at": "2026-10-25T06:00:36.516308Z",
    "payload": {
        "verdict": "PASS",
        "p0_count": 0,
        "p1_count": 0,
        "scope": "run",
        "review_profile": "strict",
        "round": 1,
        "implementer_actor": "/root",
        "judge_actor": "/root/runtime_fix_judge",
        "independence_basis": "process-separated-agent"
    }
}
